### ISSUE TITLE
EUID seems invalid

### ISSUE THREAD

**Issue by pboca** [jvitkauskas/pyit600#25]
Hello!
Have you had any issues using the EUID on the gateway?
I get an error immediately after it tries to connect and enumerate all devices. It wont succeed with readall request even if I tried all the possible combinations.

**Comment by pboca** [comment]
Also I checked everything, including Disable Local Wifi Mode set to No and also reviewed the code to see what it does.

**Comment by pekarsky** [comment]
having this (euid and address was checked a dozen times)
bash-5.1# ./main.py --host 192.168.100.185 --euid 001E5E0902621653 --debug
DEBUG:pyit600:Trying to connect to gateway at 192.168.100.185
DEBUG:pyit600:Gateway request: POST http://192.168.100.185:80/deviceid/read
{"requestAttr": "readall"}

ERROR:pyit600:Timeout while connecting to gateway: 
Authentication error: check if you have specified gateway's EUID correctly.


tcpdump in different session:
21:32:47.295717 IP 192.168.100.50.51894 > 192.168.100.185.80: tcp 0
E..<..@.@.....d2..d....P.6..........Jk.........
............
21:32:47.296145 IP 192.168.100.185.80 > 192.168.100.50.51894: tcp 0
E..<..@.@.....d...d2.P.....9.6......s..........
............
21:32:47.296232 IP 192.168.100.50.51894 > 192.168.100.185.80: tcp 0
E..4..@.@.....d2..d....P.6.....:....Jc.....
........
21:32:47.296909 IP 192.168.100.50.51894 > 192.168.100.185.80: tcp 196
E.....@.@.....d2..d....P.6.....:....K'.....
........POST /deviceid/read HTTP/1.1
Host: 192.168.100.185
content-type: application/json
Accept: */*
Accept-Encoding: gzip, deflate
User-Agent: Python/3.9 aiohttp/3.7.4.post0
Content-Length: 32


21:32:47.297064 IP 192.168.100.50.51894 > 192.168.100.185.80: tcp 32
E..T..@.@.....d2..d....P.6.....:....J......
............k).t..IB.....+Y...y........{
21:32:47.297265 IP 192.168.100.185.80 > 192.168.100.50.51894: tcp 0
E..46.@.@.....d...d2.P.....:.6.............
........
21:32:47.297337 IP 192.168.100.185.80 > 192.168.100.50.51894: tcp 0
E..46.@.@.....d...d2.P.....:.6.............
........
21:32:52.298965 IP 192.168.100.50.51894 > 192.168.100.185.80: tcp 0
E..4..@.@.....d2..d....P.6.....:....Jc.....
........
21:32:52.299233 IP 192.168.100.50.51898 > 192.168.100.185.80: tcp 0
E..<..@.@.dk..d2..d....P.:x.........Jk.........
............
21:32:52.299624 IP 192.168.100.185.80 > 192.168.100.50.51898: tcp 0
E..<..@.@.....d...d2.P.....9.:x................
............
21:32:52.299724 IP 192.168.100.50.51898 > 192.168.100.185.80: tcp 0
E..4..@.@.dr..d2..d....P.:x....:....Jc.....
........
21:32:52.300325 IP 192.168.100.50.51898 > 192.168.100.185.80: tcp 130
E.....@.@.c...d2..d....P.:x....:....J......
........GET / HTTP/1.1
Host: 192.168.100.185
Accept: */*
Accept-Encoding: gzip, deflate
User-Agent: Python/3.9 aiohttp/3.7.4.post0


21:32:52.300692 IP 192.168.100.185.80 > 192.168.100.50.51898: tcp 0
E..4..@.@.....d...d2.P.....:.:y.....$%.....
........
21:32:52.336468 IP 192.168.100.185.80 > 192.168.100.50.51894: tcp 0
E..46.@.@.....d...d2.P.....:.6.......(.....
........
21:32:52.359339 IP 192.168.100.185.80 > 192.168.100.50.51898: tcp 350
E.....@.@.....d...d2.P.....:.:y............
........HTTP/1.1 200 OK
Keep-Alive: timeout=30, max=199
X-Frame-Options: SAMEORIGIN
Content-Type: text/html
X-Content-Type-Options: nosniff
Date: Wed, 06 Oct 2021 19:32:51 GMT
ETag: "48-3584-606fcaf4"
Content-Length: 13700
X-XSS-Protection: 1; mode=block
Last-Modified: Fri, 09 Apr 2021 03:33:08 GMT
Connection: Keep-Alive
Accept-Ranges: bytes


21:32:52.359422 IP 192.168.100.50.51898 > 192.168.100.185.80: tcp 0
E..4..@.@.dp..d2..d....P.:y.........Jc.....
........
21:32:52.359511 IP 192.168.100.185.80 > 192.168.100.50.51898: tcp 1448
E.....@.@..P..d...d2.P.......:y......~.....
........<html>

  <head>
    
    <title>AppwebTest</title>
    <script src="js/jquery.js"></script>

    <script type="text/javascript">

      window.onload = function() {
      if(!window.location.hash) {
      window.location = window.location + '#loaded';
      window.location.reload();
      }
      }
      var all_data_buf = new Object();
      if (typeof JSON == 'undefined') {
        $('head').append($("<script type='text/javascript' src='json2.js'>"));
          }


        $(function(){

        //var itv = setInterval("devInfoGetting()", 5000);
        devInfogetting();
        //alert($("#device_id_select option:selected").val());
        //var obj = $("#device_id_select option:selected");
        //changeSelectID(obj);

        var itv = setInterval("web_readFromDevice()", 1000);


        });

        var content_table = new Array();
        content_table = [{"name":"Gateway", "input_type":"text", "ele_attr":["SetLedState","SetRebootGateway","SetTimeZone","SetFactoryReset_d"]},
        {"name":"ZDO", "input_type":"text", "ele_attr":["SetLeaveNetwork_d","SetRefresh_d"]},
        {"name":"Coord", "input_type":"text", "ele_attr":
21:32:52.359554 IP 192.168.100.50.51898 > 192.168.100.185.80: tcp 0
E..4..@.@.do..d2..d....P.:y...#@....Jc.....
........
21:32:52.359629 IP 192.168.100.185.80 > 192.168.100.50.51898: tcp 1448
E.....@.@..O..d...d2.P....#@.:y.....]......
........["SetPermitJoinPeriod","SetReadLocalTime_d","SetChannel_d","SetZigbeeCommand_d","SetRebootCoordinator_d","SetLocalTime_i","SetUTCTime_i"]},
        {"name":"BasicS", "input_type":"text", "ele_attr":["SetSubDeviceEnable_d"]},
        {"name":"MeterS", "input_type":"text", "ele_attr":["ResetSummationDelivered","SetRequestFastPollPeriod","SetRequestFastPollDuration"]},
        {"name":"PowerS", "input_type":"text", "ele_attr":["SetVoltage_x10"]},
        {"name":"IdentifS", "input_type":"text", "ele_attr":["SetIndicator","SetReadIdentifyTime_d"]},
        {"name":"OnOffS", "input_type":"text", "ele_attr":["SetOnOff"]},

        ];

        var content_from_table = new Array();
        content_from_table = [{"name":"Gateway", "input_type":"text", "ele_attr":["SoftwareVersion","HardwareVersion","Network_WiFiMAC","Network_WiFiIP","Network_LANMAC","Network_LANIP","NetworkWifiConnectRouterSSID","NetworkWifiConnectRouterPassword","TimeZone","DSTStart","DSTEnd","DSTShift","KeyState", "LANConnected_d","WiFiConnected_d"]},
        {"name":"ZDO", "input_type":"text", "ele_attr":["ProtocalType","FirmwareVersion","MACAddress","ShortID_d","BindTable_d","FastModeConfig_d","IsFastMode_d"]},
        {"name":"Coord", "input_type":"text", "ele_attr":["LocalTime_d", "PANID_d","Channel_d","Form_d","ReceiveZigbeeCommand_d","CoordinatorUARTError"]},
        {"name":"BasicS", "input_type":"text", "ele_attr":["ManufactureName","ModelIdentifier","Appli
21:32:52.359670 IP 192.168.100.50.51898 > 192.168.100.185.80: tcp 0
E..4..@.@.dn..d2..d....P.:y...(.....Jc.....
........
21:32:52.359888 IP 192.168.100.185.80 > 192.168.100.50.51898: tcp 1200
E.....@.@..F..d...d2.P....(..:y............
........cationVersion_d","StackVersion_d","SubDeviceName_c","DeviceType","Endpoint_d","PowerSource_d","SubDeviceEnable_d"]},
        {"name":"MeterS", "input_type":"text", "ele_attr":[ "CurrentSummationDelivered","Multiplier","Divisor","ErrorMeterSLeakDetect","ErrorStatus_d","DemandDelivered_x10k","DefaultUpdatePeriod","FastPollUpdatePeriod","FastPollEndTime","ACPhase"]},
        {"name":"PowerS", "input_type":"text", "ele_attr":[ "Voltage_x10","BatteryVoltage_x10","ErrorPowerSLowBattery","ErrorBatteryAlarmState_d","BatteryVoltageThreshold_d","BatteryVoltageThreshold1_d","BatteryVoltageThreshold2_d","BatteryVoltageThreshold3_d","BatteryAlarmMask_d"]},
        {"name":"IdentifS", "input_type":"text", "ele_attr":[ "IdentifyTime_d"]},
        {"name":"OnOffs", "input_type":"text", "ele_attr":[ "OnOff"]},
        {"name":"Product", "input_type":"text", "ele_attr":[ "Mode", "Model"]},

        ];
        //-------------------------------------------------------------------------------------------------------------


        function initDevInfo(){
        $("#web_write_data").empty();
        //alert($("#device_id_select option:selected").val());
        //alert(all_data_buf.id[obj.value][conte
21:32:52.359933 IP 192.168.100.50.51898 > 192.168.100.185.80: tcp 0
E..4..@.@.dm..d2..d....P.:y...-.....Jc.....
........
21:32:52.360493 IP 192.168.100.50.51898 > 192.168.100.185.80: tcp 0
E..4..@.@.dl..d2..d....P.:y...-.....Jc.....
........
^C
56 packets captured
56 packets received by filter
0 packets dropped by kernel

**Comment by pekarsky** [comment]
@jvitkauskas 
yes. 
I can see empty drop-down list
and "Refresh ID List" button below

Page title is "Appweb Test"

**Comment by pekarsky** [comment]
@jvitkauskas 
ok, so what I've did now:
I've added 
`                with open("salus_req_body.bin", "wb") as f:
                    f.write(self._encryptor.encrypt(request_body_json))`
to gateway.py, So I wrote encrypted body to a file.
Than I've created a POST call in Postman to URL: http://192.168.100.185:80/deviceid/read 
with binary body prom a previous step.
And I've got this:
`<!DOCTYPE html>

<head>
	<title>Request Timeout</title>
	<link rel="shortcut icon" href="data:image/x-icon;," type="image/x-icon">
</head>

<body>
	<h2>Access Error: 408 -- Request Timeout</h2>
	<pre>Exceeded inactivity timeout of 30 sec</pre>
</body>

</html>`

Any ideas?

**Comment by Ashden** [comment]
Hello,

I can confirm, the same thing happens to me. Using a Salus UGE600, I have the same error as the others:
```ERROR:pyit600:Timeout while connecting to gateway:```
```Authentication error: check if you have specified gateway's EUID correctly.```

**Comment by zylxpl** [comment]
Have the same problem. Also when try connect using Smart Home app lan option, but it miraculously connect when i log in and out of online account.

**Comment by zylxpl** [comment]
@mindvisionro 
software version: 020143210405
coordinator version: 20210317
 When access from web browser i can see empty drop down menu and "Refresh ID list" button. Disable local WiFi mode is set to no. I teste on both, wifi and cable, same result. Gateway gets it ip from DHCP server, (static dhcp lease configured on server).

If you need any more info i will happy to help.

**Comment by pekarsky** [comment]
@mindvisionro I've even tried to clone this repository to my linux and execute main.py, which have to connect to UGE600 and just download device list and it failed.

Obviously, HA integration is not working too.
I can see network traffic on interface using tcpdump, but getting bad response, probably, because of bad request. I'll try to play around after my holidays - maybe region change will solve the issue

**Comment by mindvisionro** [comment]
> 
> 
> @mindvisionro I've even tried to clone this repository to my linux and execute main.py, which have to connect to UGE600 and just download device list and it failed.
> 
> Obviously, HA integration is not working too. I can see network traffic on interface using tcpdump, but getting bad response, probably, because of bad request. I'll try to play around after my holidays - maybe region change will solve the issue

Yeah, I really don't know where the problem might be, what else I'd try, try resetting the gateway.

**Comment by loopez76** [comment]
same issue - even verified euid with salus - tried everything above - no success

**Comment by jvitkauskas** [comment]
Some people mentioned that 0000000000000000 as euid might work https://github.com/jvitkauskas/homeassistant_salus/issues/20

**Comment by Ashden** [comment]
I actually had the time now to check, and the EUID 0000000000000000 actually works!
